{"incident_id": "sample0000000000", "schema_version": "1.1", "severity": "high", "detected_at": "2026-08-15T00:00:06Z", "environment": "development", "service": "checkout-api", "affected_component": "/checkout", "impact": {"metric": "occurrence_count", "value": "2"}, "summary": "checkout-api checkout requests are failing with ZeroDivisionError. This looks like a division-by-zero when stock reaches the requested quantity.", "symptoms": ["HTTP 500 on POST /checkout", "ZeroDivisionError raised in calculate_total"], "error_clusters": [{"signature": "development:checkout-api:ZeroDivisionError:calculate_total:Unhandled exception:/checkout", "count": 2, "first_seen": "2026-08-15T00:00:00Z", "last_seen": "2026-08-15T00:00:05Z", "sample_message": "Unhandled exception", "severity": "high"}], "observed_facts": [{"statement": "ZeroDivisionError occurred 2 time(s) in service 'checkout-api' (development)", "evidence": [{"log_query_or_reference": "sample-raw-ref-1", "timestamp": "2026-08-15T00:00:05Z", "count": 2}]}, {"statement": "The error message was: float division by zero", "evidence": [{"log_query_or_reference": "sample-raw-ref-1", "timestamp": "2026-08-15T00:00:05Z"}]}], "timeline": [{"timestamp": "2026-08-15T00:00:00Z", "event": "First occurrence observed"}, {"timestamp": "2026-08-15T00:00:05Z", "event": "Most recent occurrence observed"}, {"timestamp": "2026-08-15T00:00:06Z", "event": "Tracy detected this as an incident"}], "hypotheses": [{"statement": "remaining_after_purchase reached zero when requested quantity equals remaining stock, causing a division by zero", "confidence": 0.85}], "suspected_root_cause": "remaining_after_purchase reached zero when requested quantity equals remaining stock, causing a division by zero", "confidence_overall": 0.85, "recommended_investigation": ["Inspect calculate_total in checkout-api/app/pricing.py for a zero-guard on remaining_after_purchase"], "log_references": ["sample-raw-ref-1"]}